{"schemaVersion":"cobol-ir.v1","programId":"PERFORM-INLINE","paragraphs":{"MAIN":{"name":"MAIN","statements":[{"paragraph":null,"throughParagraph":null,"varyingVariable":"WS-IDX","varyingFrom":"1","varyingBy":"1","untilCondition":"WS-IDX > 1","testAfter":true,"inlineBody":[{"source":"WS-IDX","target":"WS-TRACE-NUM"}]}]}},"dataItems":[{"name":"WS-IDX","picture":"9(2)","level":1,"occurs":null,"redefines":null,"javaType":"Integer","picType":{"category":"NUMERIC","digits":2,"scale":0,"signed":false,"usage":"DISPLAY"},"level88Conditions":[]},{"name":"WS-TRACE-NUM","picture":"9(2)","level":1,"occurs":null,"redefines":null,"javaType":"Integer","picType":{"category":"NUMERIC","digits":2,"scale":0,"signed":false,"usage":"DISPLAY"},"level88Conditions":[]}],"controlFlowGraph":{"adjacency":{"MAIN":[]}},"executionContext":{"variableScopes":{"WS-IDX":"working-storage","WS-TRACE-NUM":"working-storage"},"attributes":{"programId":"PERFORM-INLINE"}},"controlBreakPatterns":[],"decomposedLogic":null,"diagnostics":[]}