{"schemaVersion":"cobol-ir.v1","programId":"PERFORM-TIMES","paragraphs":{"MAIN":{"name":"MAIN","statements":[{"paragraph":null,"throughParagraph":null,"timesCount":3,"testAfter":false,"inlineBody":[{"source":"'READY'","target":"WS-TRACE"}]}]}},"dataItems":[{"name":"WS-TRACE","picture":"X(10)","level":1,"occurs":null,"redefines":null,"javaType":"String","picType":{"category":"ALPHANUMERIC","digits":10,"scale":0,"signed":false,"usage":"DISPLAY"},"level88Conditions":[]}],"controlFlowGraph":{"adjacency":{"MAIN":[]}},"executionContext":{"variableScopes":{"WS-TRACE":"working-storage"},"attributes":{"programId":"PERFORM-TIMES"}},"controlBreakPatterns":[],"decomposedLogic":null,"diagnostics":[]}