{"schemaVersion":"cobol-ir.v1","programId":"PERFORM-THRU","paragraphs":{"1000-PARA":{"name":"1000-PARA","statements":[{"source":"'1-1000'","target":"WS-FIRST"}]},"2000-PARA":{"name":"2000-PARA","statements":[{"source":"'2-2000'","target":"WS-SECOND"}]},"MAIN":{"name":"MAIN","statements":[{"paragraph":"1000-PARA","throughParagraph":"2000-PARA","testAfter":false}]}},"dataItems":[{"name":"WS-FIRST","picture":"X(10)","level":1,"occurs":null,"redefines":null,"javaType":"String","picType":{"category":"ALPHANUMERIC","digits":10,"scale":0,"signed":false,"usage":"DISPLAY"},"level88Conditions":[]},{"name":"WS-SECOND","picture":"X(10)","level":1,"occurs":null,"redefines":null,"javaType":"String","picType":{"category":"ALPHANUMERIC","digits":10,"scale":0,"signed":false,"usage":"DISPLAY"},"level88Conditions":[]}],"controlFlowGraph":{"adjacency":{"1000-PARA":["2000-PARA"],"2000-PARA":[],"MAIN":["1000-PARA"]}},"executionContext":{"variableScopes":{"WS-FIRST":"working-storage","WS-SECOND":"working-storage"},"attributes":{"programId":"PERFORM-THRU"}},"controlBreakPatterns":[],"decomposedLogic":null,"diagnostics":[]}