{"schemaVersion":"cobol-ir.v1","programId":"INITIALIZE-SET","paragraphs":{"MAIN":{"name":"MAIN","statements":[{"targets":["CUSTOMER-NAME","CUSTOMER-COUNT"],"sourceText":"INITIALIZE CUSTOMER-NAME CUSTOMER-COUNT"},{"conditionNames":["CUSTOMER-READY"],"value":true,"sourceText":"SET CUSTOMER-READY TO TRUE"},{"conditionNames":["CUSTOMER-READY"],"value":false,"sourceText":"SET CUSTOMER-READY TO FALSE"}]}},"dataItems":[],"diagnostics":[]}
