{"schemaVersion":"cobol-ir.v1","programId":"PERFORM-UNTIL","paragraphs":{"MAIN":{"name":"MAIN","statements":[{"paragraph":null,"throughParagraph":null,"untilCondition":"WS-COUNT > 0","testAfter":false,"inlineBody":[{"source":"1","target":"WS-COUNT"}]}]}},"dataItems":[{"name":"WS-COUNT","picture":"9(2)","level":1,"occurs":null,"redefines":null,"javaType":"Integer","picType":{"category":"NUMERIC","digits":2,"scale":0,"signed":false,"usage":"DISPLAY"},"level88Conditions":[]}],"controlFlowGraph":{"adjacency":{"MAIN":[]}},"executionContext":{"variableScopes":{"WS-COUNT":"working-storage"},"attributes":{"programId":"PERFORM-UNTIL"}},"controlBreakPatterns":[],"decomposedLogic":null,"diagnostics":[]}