{"schemaVersion":"cobol-ir.v1","programId":"PERFORM-NESTED","paragraphs":{"INNER-PARA":{"name":"INNER-PARA","statements":[{"source":"'2-INNER'","target":"WS-TRACE"}]},"MAIN":{"name":"MAIN","statements":[{"paragraph":"OUTER-PARA","throughParagraph":null,"testAfter":false}]},"OUTER-PARA":{"name":"OUTER-PARA","statements":[{"source":"'1-OUTER'","target":"WS-TRACE"},{"paragraph":"INNER-PARA","throughParagraph":null,"testAfter":false}]}},"dataItems":[{"name":"WS-TRACE","picture":"X(10)","level":1,"occurs":null,"redefines":null,"javaType":"String","picType":{"category":"ALPHANUMERIC","digits":10,"scale":0,"signed":false,"usage":"DISPLAY"},"level88Conditions":[]}],"controlFlowGraph":{"adjacency":{"INNER-PARA":[],"MAIN":["OUTER-PARA"],"OUTER-PARA":["INNER-PARA"]}},"executionContext":{"variableScopes":{"WS-TRACE":"working-storage"},"attributes":{"programId":"PERFORM-NESTED"}},"controlBreakPatterns":[],"decomposedLogic":null,"diagnostics":[]}